Name	title	coding
t2_ciktnahx	NOAH SCENTED MAYO SPOTTED AT TIPSY COW	o
t2_fej51279	Mclennan/Redpath	o
t2_eix8v0eg	Can't stop crying every day	o
t2_9f7y1546	FREN 231 - Linguistique français as a non-native speaker?	c
t2_16adr5	I have seen a white squirrel outside of Mcgill	o
t2_2lp4za53	Leetcode club?	o
t2_gezl8h7l	"Found Cloudberry's nemesis, does he have a name?"	o
t2_dnp3t5lg	Religions of east Asia	c
t2_4p7y2p3x	Can Profs remove rate my prof ratings/comments?	c
t2_5b5nmxbh	Working at a residence dining hall?	r
t2_5g19fybk	Does Prof. Daniel Cere award grades above 85% / is common or possible to get 90-95% ?	c
t2_cfqgbgr7	How safe are the buildings lockers?	o
t2_902r38s2	Unlimited Maple appointments ?	o
t2_9dq8ysiv	Anyone else gonna be an old ass undergrad?	o
t2_gdu2j8xw	Get Paid to do Self-Guided Research! McGill Journal of Human Behavior Research Fellowship	o
t2_43toleqc	Question/concerns regarding inter-faculty Major transfer	c
t2_33lx29c	Group chat for Econ408	c
t2_12p9tg	Present thoughts (Rant)	o
t2_7ccolk5k	someone should start a dating club at McGill	o
t2_2g7bd7yw	Is there a difference between PSYC 395 and 494?	c
t2_10ytox	I’ve been here for 5 damn years and I finally got to see cloudberry!! She is perfect.	o
t2_8non0pad	The 200 students in person limit	c
t2_finh6l2	French courses at McGill FRSL vs CEFN	c
t2_53hga3af	FINE 441 projects	c
t2_1qqwmfpv	Your experience in MATH 396/410	c
t2_gcnvp1cg	Difficulty to find a date at McGill :/	o
t2_9q4e1thg	Grading at McGill	c
t2_863mjwav	How long does it take to get official transcripts?	c
t2_ci0nq	Comp 598 students: Should res provide better vegetarian food options?	c
t2_gceezkb3	what is this about? seems sus	o
t2_8nxn719x	Peculiar microwave ?	f
t2_4qzh8p	Fast pass sticker??	o
t2_8ez3tpxh	DONE WITH HEALTH SERVICES	o
t2_aw8ex9n7	Struggling with Language at Work	o
t2_8gwta5yc	In-person final exams set in stone?	c
t2_4l05uj5m	International student insurance coverage for consultation with a doctor outside McGill	o
t2_5c3mn22g	Is there free COVID testing for McGill students?	o
t2_eq2sg7z1	My only source for a reference doesn't want to be a reference - what to do?	o
t2_xf5mp	On-campus study spots with nice outside view ?	o
t2_9rbi8sze	COMP 252	c
t2_6fa58fkk	BIOC 311. oh my god	c
t2_g6ui8vw9	Lost Goggle	o
t2_dxw8ktyj	Winter term at Udem?	c
t2_dc9m9ec3	How doable is it to take GERM325 and GERM336 in the same semester?	c
t2_5e8mmna4	Quick SOCI235 Questions	c
t2_5pw6rnky	Is it cold on campus today?	o
t2_15zqc1	"SSMU Dental Insurance maxed out, what should I do"	o
t2_543tmyez	Cloudberry and a friend	o
t2_8244qsks	Is Submitting a Final Exam Paper to a Journal Problematic?	o
t2_5lwvqiy9	Winter 2022 Exchange Reinstatement: Australia	o
